{
  "schema_version": 1,
  "destination_slug": "nha-trang",
  "database_license": "ODbL-1.0",
  "attribution": "© OpenStreetMap contributors; database under ODbL-1.0. Original editorial additions: travel-planner project.",
  "records": [
    {
      "id": "f030eb22-727e-55e4-97d5-7fc3f5d6b344",
      "slug": "lau-bao-dai",
      "title_vi": "Lầu Bảo Đại",
      "category": "culture",
      "description_vi": "Điểm dừng tìm hiểu không gian kiến trúc gắn với tên gọi Lầu Bảo Đại; hãy xác nhận khu vực được phép tham quan.",
      "lat": 12.2103078,
      "lng": 109.2153658,
      "coordinate_quality": "community_point",
      "recommended_duration_min": 60,
      "duration_basis": "editorial_suggestion_not_measured",
      "visit_priority": 50,
      "hours_state": "hours_unknown",
      "editorial_hours": null,
      "hours_source": null,
      "hours_checked_at": null,
      "content_checked_at": "2026-10-21",
      "verification_scope": "open_source_identity_coordinates_only",
      "status": "draft",
      "image": {
        "path": "docs/content/illustrations/culture.svg",
        "alt_vi": "Minh họa biểu trưng nhóm culture cho Lầu Bảo Đại; không mô tả địa điểm thực tế.",
        "kind": "original_symbolic_category_illustration",
        "creator": "Codex, commissioned by project owner in chat 2026-10-21",
        "license": "project-original-authorized-use",
        "rights_evidence": "docs/content/RIGHTS.md"
      },
      "data_source": {
        "provider": "openstreetmap",
        "object_type": "node",
        "object_id": 849300563,
        "version": 7,
        "url": "https://www.openstreetmap.org/node/849300563",
        "license": "ODbL-1.0",
        "license_url": "https://opendatacommons.org/licenses/odbl/1-0/",
        "snapshot": "docs/content/sources/osm-selected.json",
        "retrieved_on": "2026-10-21"
      },
      "caution_notes": [
        "Giờ hoạt động và quyền tiếp cận chưa được xác minh tại chỗ.",
        "Minh họa biểu trưng theo nhóm, không phải ảnh hoặc bản vẽ chính xác của địa điểm."
      ],
      "transport_constraint": "access_unverified"
    },
    {
      "id": "084b94be-ceec-5c82-9150-6f5437babd42",
      "slug": "tram-trung",
      "title_vi": "Khu tắm bùn Trăm Trứng",
      "category": "attraction",
      "description_vi": "Gợi ý dành một buổi cho khu tắm bùn Trăm Trứng; thời lượng là đề xuất, cần hỏi lại dịch vụ và điều kiện vào cửa.",
      "lat": 12.1873048,
      "lng": 109.1610564,
      "coordinate_quality": "community_point",
      "recommended_duration_min": 180,
      "duration_basis": "editorial_suggestion_not_measured",
      "visit_priority": 50,
      "hours_state": "hours_unknown",
      "editorial_hours": null,
      "hours_source": null,
      "hours_checked_at": null,
      "content_checked_at": "2026-10-21",
      "verification_scope": "open_source_identity_coordinates_only",
      "status": "draft",
      "image": {
        "path": "docs/content/illustrations/attraction.svg",
        "alt_vi": "Minh họa biểu trưng nhóm attraction cho Khu tắm bùn Trăm Trứng; không mô tả địa điểm thực tế.",
        "kind": "original_symbolic_category_illustration",
        "creator": "Codex, commissioned by project owner in chat 2026-10-21",
        "license": "project-original-authorized-use",
        "rights_evidence": "docs/content/RIGHTS.md"
      },
      "data_source": {
        "provider": "openstreetmap",
        "object_type": "node",
        "object_id": 4172003998,
        "version": 3,
        "url": "https://www.openstreetmap.org/node/4172003998",
        "license": "ODbL-1.0",
        "license_url": "https://opendatacommons.org/licenses/odbl/1-0/",
        "snapshot": "docs/content/sources/osm-selected.json",
        "retrieved_on": "2026-10-21"
      },
      "caution_notes": [
        "Giờ hoạt động và quyền tiếp cận chưa được xác minh tại chỗ.",
        "Minh họa biểu trưng theo nhóm, không phải ảnh hoặc bản vẽ chính xác của địa điểm."
      ],
      "transport_constraint": "access_unverified"
    },
    {
      "id": "a6b5904c-b82d-532a-8688-4abbc33b2651",
      "slug": "hon-chong",
      "title_vi": "Hòn Chồng",
      "category": "attraction",
      "description_vi": "Điểm dừng ngắm cảnh ven biển Hòn Chồng; kiểm tra lối đi và điều kiện tiếp cận trước khi ghé.",
      "lat": 12.2719555,
      "lng": 109.2059818,
      "coordinate_quality": "community_point",
      "recommended_duration_min": 60,
      "duration_basis": "editorial_suggestion_not_measured",
      "visit_priority": 50,
      "hours_state": "hours_unknown",
      "editorial_hours": null,
      "hours_source": null,
      "hours_checked_at": null,
      "content_checked_at": "2026-10-21",
      "verification_scope": "open_source_identity_coordinates_only",
      "status": "draft",
      "image": {
        "path": "docs/content/illustrations/attraction.svg",
        "alt_vi": "Minh họa biểu trưng nhóm attraction cho Hòn Chồng; không mô tả địa điểm thực tế.",
        "kind": "original_symbolic_category_illustration",
        "creator": "Codex, commissioned by project owner in chat 2026-10-21",
        "license": "project-original-authorized-use",
        "rights_evidence": "docs/content/RIGHTS.md"
      },
      "data_source": {
        "provider": "openstreetmap",
        "object_type": "node",
        "object_id": 4884705621,
        "version": 8,
        "url": "https://www.openstreetmap.org/node/4884705621",
        "license": "ODbL-1.0",
        "license_url": "https://opendatacommons.org/licenses/odbl/1-0/",
        "snapshot": "docs/content/sources/osm-selected.json",
        "retrieved_on": "2026-10-21"
      },
      "caution_notes": [
        "Giờ hoạt động và quyền tiếp cận chưa được xác minh tại chỗ.",
        "Minh họa biểu trưng theo nhóm, không phải ảnh hoặc bản vẽ chính xác của địa điểm."
      ],
      "transport_constraint": "access_unverified"
    },
    {
      "id": "3500345e-b6e0-5c49-b8d8-81b7c040d34d",
      "slug": "phong-tranh-long-thanh",
      "title_vi": "Phòng tranh Long Thanh",
      "category": "museum",
      "description_vi": "Gợi ý ghé không gian trưng bày Long Thanh; liên hệ trước để xác nhận thời gian đón khách.",
      "lat": 12.2506272,
      "lng": 109.1872613,
      "coordinate_quality": "community_point",
      "recommended_duration_min": 45,
      "duration_basis": "editorial_suggestion_not_measured",
      "visit_priority": 50,
      "hours_state": "hours_unknown",
      "editorial_hours": null,
      "hours_source": null,
      "hours_checked_at": null,
      "content_checked_at": "2026-10-21",
      "verification_scope": "open_source_identity_coordinates_only",
      "status": "draft",
      "image": {
        "path": "docs/content/illustrations/museum.svg",
        "alt_vi": "Minh họa biểu trưng nhóm museum cho Phòng tranh Long Thanh; không mô tả địa điểm thực tế.",
        "kind": "original_symbolic_category_illustration",
        "creator": "Codex, commissioned by project owner in chat 2026-10-21",
        "license": "project-original-authorized-use",
        "rights_evidence": "docs/content/RIGHTS.md"
      },
      "data_source": {
        "provider": "openstreetmap",
        "object_type": "node",
        "object_id": 5189505622,
        "version": 2,
        "url": "https://www.openstreetmap.org/node/5189505622",
        "license": "ODbL-1.0",
        "license_url": "https://opendatacommons.org/licenses/odbl/1-0/",
        "snapshot": "docs/content/sources/osm-selected.json",
        "retrieved_on": "2026-10-21"
      },
      "caution_notes": [
        "Giờ hoạt động và quyền tiếp cận chưa được xác minh tại chỗ.",
        "Minh họa biểu trưng theo nhóm, không phải ảnh hoặc bản vẽ chính xác của địa điểm."
      ],
      "transport_constraint": "access_unverified"
    },
    {
      "id": "a823e570-151d-50bd-9e35-a478bdb64c1d",
      "slug": "phong-anh-mai-loc",
      "title_vi": "Phòng ảnh Mai Lộc",
      "category": "museum",
      "description_vi": "Điểm ghé dành cho người quan tâm ảnh tại phòng ảnh Mai Lộc; nội dung trưng bày cần được xác nhận tại thời điểm đi.",
      "lat": 12.2344148,
      "lng": 109.1946157,
      "coordinate_quality": "community_point",
      "recommended_duration_min": 45,
      "duration_basis": "editorial_suggestion_not_measured",
      "visit_priority": 50,
      "hours_state": "hours_unknown",
      "editorial_hours": null,
      "hours_source": null,
      "hours_checked_at": null,
      "content_checked_at": "2026-10-21",
      "verification_scope": "open_source_identity_coordinates_only",
      "status": "draft",
      "image": {
        "path": "docs/content/illustrations/museum.svg",
        "alt_vi": "Minh họa biểu trưng nhóm museum cho Phòng ảnh Mai Lộc; không mô tả địa điểm thực tế.",
        "kind": "original_symbolic_category_illustration",
        "creator": "Codex, commissioned by project owner in chat 2026-10-21",
        "license": "project-original-authorized-use",
        "rights_evidence": "docs/content/RIGHTS.md"
      },
      "data_source": {
        "provider": "openstreetmap",
        "object_type": "node",
        "object_id": 7087673293,
        "version": 1,
        "url": "https://www.openstreetmap.org/node/7087673293",
        "license": "ODbL-1.0",
        "license_url": "https://opendatacommons.org/licenses/odbl/1-0/",
        "snapshot": "docs/content/sources/osm-selected.json",
        "retrieved_on": "2026-10-21"
      },
      "caution_notes": [
        "Giờ hoạt động và quyền tiếp cận chưa được xác minh tại chỗ.",
        "Minh họa biểu trưng theo nhóm, không phải ảnh hoặc bản vẽ chính xác của địa điểm."
      ],
      "transport_constraint": "access_unverified"
    },
    {
      "id": "4d9bec32-3cbc-534b-b9a2-8fb6245fc5ae",
      "slug": "lang-nghe-truong-son",
      "title_vi": "Làng nghề Trường Sơn",
      "category": "culture",
      "description_vi": "Gợi ý tìm hiểu không gian làng nghề Trường Sơn; hỏi trước về hoạt động đang mở và thời lượng trải nghiệm.",